{"consumer_contract_version":"2.0","fragments":[{"field":"/conclusion","value":"資源関連の株価が市場平均より強くなっています。"},{"field":"/investment_meaning","value":"市場全体の広がりを確認してから、新規調査の範囲を決めます。"},{"field":"/cautions/0","value":"今回は初期観測のため、現在の強弱だけを評価しています。変化の判定にはあと2週分の履歴が必要です。"},{"field":"/cautions/1","value":"実際の資金流入額は確認できません。"},{"field":"/next_checks/0","value":"市場平均を上回る業種の数が次週も増えるか"}],"kind":"phase","meta":{"data_date":"2026-07-31","run_id":"ddd12cd862d8798a69811acf9d711c6d25b9b22820369c3e8481914e50c33253","source_commit":"2c79c9ffb6dbda122ad8fc1ef17ccb626567b30c","source_sha256":"a303de70af28eaa996e57ca61be7215c27655252ebfe0a10094ac74858b46230","status":"success"},"part":1,"part_count":1,"phase":1,"source_identity":{"analysis_id":"ddd12cd862d8798a69811acf9d711c6d25b9b22820369c3e8481914e50c33253","generation_id":"981172bcedb346c7d1199450631dd4995234e54afe560cf60ce47d63bddeb25f"}}
