{"consumer_contract_version":"2.0","fragments":[{"field":"/conclusion","value":"現在は「大型バリュー」が相対的に強い状態です。"},{"field":"/investment_meaning","value":"強いスタイルと逆方向の銘柄は、調査の優先度を下げます。"},{"field":"/cautions/0","value":"ETFは傾向を示す代理指標で、個別企業の質を保証しません。"},{"field":"/next_checks/0","value":"最近の強さが長めの傾向と一致するか"}],"kind":"phase","meta":{"data_date":"2026-07-31","run_id":"3c07b5c0e7a3ed0c8aabcce577be51f4906abff8755f2e1f16305b55a043dbdb","source_commit":"742e59c2db9c59bc4956cee6e6925060323fb825","source_sha256":"a3f410670be797e1f45928e50de23cc216c1d0717e3ffb58f6d7ed19e3b28c8b","status":"success"},"part":1,"part_count":1,"phase":2,"source_identity":{"analysis_id":"3c07b5c0e7a3ed0c8aabcce577be51f4906abff8755f2e1f16305b55a043dbdb","generation_id":"6c2260ba8b98d8fccd20d14e35fb616ff40e1d7bc1d7af296cf514e962deffa0"}}
