{"consumer_contract_version":"2.0","fragments":[{"field":"/buckets/3/items/1/source","value":"dynamic_industry"},{"field":"/buckets/3/items/1/classification_explanation","value":"現在の価格、広がり、集中度または反対材料から、調査優先度を下げています。"},{"field":"/buckets/3/items/1/relative_strength_4w","value":-0.0676700049959799},{"field":"/buckets/3/items/1/breadth_above_50dma","value":0.2},{"field":"/buckets/3/items/1/concentration_top1","value":null},{"field":"/buckets/3/items/1/structural_context_status","value":"not_assessed"},{"field":"/buckets/3/items/1/recovery_condition","value":"相対強度と上昇銘柄の広がりが同時に改善するかを次回確認します。"},{"field":"/buckets/3/items/1/largest_counter_evidence","value":"明示的な反対条件は検出されていません。"},{"field":"/buckets/3/items/2/id","value":"infrastructure_construction"},{"field":"/buckets/3/items/2/label","value":"インフラ建設"},{"field":"/buckets/3/items/2/source","value":"dynamic_industry"},{"field":"/buckets/3/items/2/classification_explanation","value":"現在の価格、広がり、集中度または反対材料から、調査優先度を下げています。"},{"field":"/buckets/3/items/2/relative_strength_4w","value":-0.11644308727784222},{"field":"/buckets/3/items/2/breadth_above_50dma","value":0.0},{"field":"/buckets/3/items/2/concentration_top1","value":null},{"field":"/buckets/3/items/2/structural_context_status","value":"not_assessed"},{"field":"/buckets/3/items/2/recovery_condition","value":"相対強度と上昇銘柄の広がりが同時に改善するかを次回確認します。"},{"field":"/buckets/3/items/2/largest_counter_evidence","value":"明示的な反対条件は検出されていません。"},{"field":"/buckets/3/items/3/id","value":"retail"},{"field":"/buckets/3/items/3/label","value":"小売"},{"field":"/buckets/3/items/3/source","value":"dynamic_industry"},{"field":"/buckets/3/items/3/classification_explanation","value":"現在の価格、広がり、集中度または反対材料から、調査優先度を下げています。"},{"field":"/buckets/3/items/3/relative_strength_4w","value":0.02704018167982496},{"field":"/buckets/3/items/3/breadth_above_50dma","value":0.2},{"field":"/buckets/3/items/3/concentration_top1","value":0.5510312623651039},{"field":"/buckets/3/items/3/structural_context_status","value":"not_assessed"},{"field":"/buckets/3/items/3/recovery_condition","value":"相対強度と上昇銘柄の広がりが同時に改善するかを次回確認します。"},{"field":"/buckets/3/items/3/largest_counter_evidence","value":"明示的な反対条件は検出されていません。"},{"field":"/buckets/3/items/4/id","value":"transportation"},{"field":"/buckets/3/items/4/label","value":"運輸"},{"field":"/buckets/3/items/4/source","value":"dynamic_industry"}],"kind":"detail","meta":{"data_date":"2026-07-31","run_id":"3c07b5c0e7a3ed0c8aabcce577be51f4906abff8755f2e1f16305b55a043dbdb","source_commit":"742e59c2db9c59bc4956cee6e6925060323fb825","source_sha256":"a3f410670be797e1f45928e50de23cc216c1d0717e3ffb58f6d7ed19e3b28c8b","status":"success"},"part":3,"part_count":6,"phase":4,"source_identity":{"analysis_id":"3c07b5c0e7a3ed0c8aabcce577be51f4906abff8755f2e1f16305b55a043dbdb","generation_id":"6c2260ba8b98d8fccd20d14e35fb616ff40e1d7bc1d7af296cf514e962deffa0"}}
