{"consumer_contract_version":"2.0","fragments":[{"field":"/conclusion","value":"個別企業の調査候補は次のとおりです。OXY（石油・ガス開発）は代表企業です。石油・ガス開発の代表企業として中心的な強さを確認するためです。 最重要確認事項は「生産量と実現価格が設備投資後の自由現金収支を維持できるか」。最大の反対材料は「商品価格下落やコスト上昇で株主還元の原資が減ること」。 COP（石油・ガス開発）は広がり確認用企業です。石油・ガス開発の別企業にも及ぶ上昇の広がりを確認するためです。 最重要確認事項は「生産効率と資本規律が複数の開発企業で確認できるか」。最大の反対材料は「一社の資産構成だけが有利で、同業の現金収支が弱いこと」。"},{"field":"/investment_meaning","value":"1対象につき最大2社とし、代表企業と広がり確認用企業を分けて調べます。"},{"field":"/cautions/0","value":"候補は売買推奨ではなく、決算・競争力・割高感を調べる入口です。"},{"field":"/next_checks/0","value":"各社の最重要確認事項と反対材料を一次資料で確かめる"}],"kind":"phase","meta":{"data_date":"2026-07-31","run_id":"1358de247d71e84230463f25033c42fedb81cdae8ba307bafaf9719dfecf525f","source_commit":"2784c3f9e22f27396e9412498f6966e9b81e8c32","source_sha256":"8e2e9f686dc9da9f180a37f714c3a876b0be2ddeebe77ca97aee96f674c88d84","status":"success"},"part":1,"part_count":1,"phase":5,"source_identity":{"analysis_id":"1358de247d71e84230463f25033c42fedb81cdae8ba307bafaf9719dfecf525f","generation_id":"b3a39afecf11c4cb04695f854bdb47d39a67d56f07c7d52d589d4503dd90a563"}}
