{"consumer_contract_version":"2.0","fragments":[{"field":"/title","value":"セクター・業種の監査説明"},{"field":"/top_sectors/0/ticker","value":"XLE"},{"field":"/top_sectors/0/label","value":"エネルギー"},{"field":"/top_sectors/0/return_1w","value":-0.0011740975524704433},{"field":"/top_sectors/0/return_4w","value":0.12762729953607477},{"field":"/top_sectors/0/return_13w","value":0.005523181814434119},{"field":"/top_sectors/0/relative_strength_4w","value":0.1259243126306102},{"field":"/top_sectors/0/above_50dma","value":true},{"field":"/top_sectors/0/above_200dma","value":true},{"field":"/top_sectors/1/ticker","value":"XLF"},{"field":"/top_sectors/1/label","value":"金融"},{"field":"/top_sectors/1/return_1w","value":0.011188017013915141},{"field":"/top_sectors/1/return_4w","value":0.039430447162193794},{"field":"/top_sectors/1/return_13w","value":0.09609546695428883},{"field":"/top_sectors/1/relative_strength_4w","value":0.03772746025672924},{"field":"/top_sectors/1/above_50dma","value":true},{"field":"/top_sectors/1/above_200dma","value":true},{"field":"/top_sectors/2/ticker","value":"XLP"},{"field":"/top_sectors/2/label","value":"生活必需品"},{"field":"/top_sectors/2/return_1w","value":0.010935526308988086},{"field":"/top_sectors/2/return_4w","value":0.021008402591685904},{"field":"/top_sectors/2/return_13w","value":0.015776709202725003},{"field":"/top_sectors/2/relative_strength_4w","value":0.01930541568622135},{"field":"/top_sectors/2/above_50dma","value":true},{"field":"/top_sectors/2/above_200dma","value":true},{"field":"/bottom_sectors/0/ticker","value":"XLK"},{"field":"/bottom_sectors/0/label","value":"情報技術"},{"field":"/bottom_sectors/0/return_1w","value":-0.00301341121550458},{"field":"/bottom_sectors/0/return_4w","value":-0.05532803191373925},{"field":"/bottom_sectors/0/return_13w","value":0.10068393952306898},{"field":"/bottom_sectors/0/relative_strength_4w","value":-0.057031018819203805},{"field":"/bottom_sectors/0/above_50dma","value":false},{"field":"/bottom_sectors/0/above_200dma","value":true},{"field":"/bottom_sectors/1/ticker","value":"XLI"},{"field":"/bottom_sectors/1/label","value":"資本財"},{"field":"/bottom_sectors/1/return_1w","value":-0.01543855944202921},{"field":"/bottom_sectors/1/return_4w","value":-0.01919723091592429},{"field":"/bottom_sectors/1/return_13w","value":0.032663859681710594},{"field":"/bottom_sectors/1/relative_strength_4w","value":-0.020900217821388845},{"field":"/bottom_sectors/1/above_50dma","value":true},{"field":"/bottom_sectors/1/above_200dma","value":true},{"field":"/bottom_sectors/2/ticker","value":"XLY"},{"field":"/bottom_sectors/2/label","value":"一般消費財"},{"field":"/bottom_sectors/2/return_1w","value":0.0610546792084119},{"field":"/bottom_sectors/2/return_4w","value":-0.016936235600155336},{"field":"/bottom_sectors/2/return_13w","value":-0.01714127442645974},{"field":"/bottom_sectors/2/relative_strength_4w","value":-0.01863922250561989}],"kind":"detail","meta":{"data_date":"2026-07-31","run_id":"ddd12cd862d8798a69811acf9d711c6d25b9b22820369c3e8481914e50c33253","source_commit":"2c79c9ffb6dbda122ad8fc1ef17ccb626567b30c","source_sha256":"a303de70af28eaa996e57ca61be7215c27655252ebfe0a10094ac74858b46230","status":"success"},"part":1,"part_count":4,"phase":3,"source_identity":{"analysis_id":"ddd12cd862d8798a69811acf9d711c6d25b9b22820369c3e8481914e50c33253","generation_id":"981172bcedb346c7d1199450631dd4995234e54afe560cf60ce47d63bddeb25f"}}
