{"consumer_contract_version":"2.0","fragments":[{"field":"/conclusion","value":"と」。 AVAV（防衛）は広がり確認用企業です。防衛の別企業にも及ぶ上昇の広がりを確認するためです。 最重要確認事項は「航空・ミサイル・電子戦など複数領域で受注が拡大しているか」。最大の反対材料は「特定プログラムだけに依存し、他領域の受注残が増えないこと」。"},{"field":"/investment_meaning","value":"1対象につき最大2社とし、代表企業と広がり確認用企業を分けて調べます。"},{"field":"/cautions/0","value":"候補は売買推奨ではなく、決算・競争力・割高感を調べる入口です。"},{"field":"/next_checks/0","value":"各社の最重要確認事項と反対材料を一次資料で確かめる"}],"kind":"phase","meta":{"data_date":"2026-07-23","run_id":"352903ee123e026d13541e286657d59ea95ed331a39970cc1c5ee98c7a0a3e43","source_commit":"570540590fb6a9ab4defc8dd6e9d292481bed2af","source_sha256":"ecdca81f3cfe59f49970c95ba366c518f1fa8135714499910d37cf49f3186644","status":"success"},"part":2,"part_count":2,"phase":5,"source_identity":{"analysis_id":"352903ee123e026d13541e286657d59ea95ed331a39970cc1c5ee98c7a0a3e43","generation_id":"e29bfda3e4c5534368e35026987f7bc57e2ddcdd2b6aae2833126729a7aeaf48"}}
