{"consumer_contract_version":"2.0","fragments":[{"field":"/breadth_and_concentration/1","value":"単一銘柄だけの上昇か、複数銘柄へ広がっているかはテーマ段階でも別に確認します。"},{"field":"/data_gaps/0","value":"VUL"}],"kind":"detail","meta":{"data_date":"2026-07-31","run_id":"1358de247d71e84230463f25033c42fedb81cdae8ba307bafaf9719dfecf525f","source_commit":"2784c3f9e22f27396e9412498f6966e9b81e8c32","source_sha256":"8e2e9f686dc9da9f180a37f714c3a876b0be2ddeebe77ca97aee96f674c88d84","status":"success"},"part":4,"part_count":4,"phase":3,"source_identity":{"analysis_id":"1358de247d71e84230463f25033c42fedb81cdae8ba307bafaf9719dfecf525f","generation_id":"b3a39afecf11c4cb04695f854bdb47d39a67d56f07c7d52d589d4503dd90a563"}}
