{"consumer_contract_version":"2.0","fragments":[{"field":"/dynamic_selected/0/explanation","value":"ETF相対強度と複数企業の広がりが設定済み基準を満たしました。"},{"field":"/dynamic_excluded/0/id","value":"biotechnology"},{"field":"/dynamic_excluded/0/label","value":"バイオテクノロジー"},{"field":"/dynamic_excluded/0/explanation","value":"業種ETFの4週相対強度が採用基準に届きませんでした。 構成企業の直近の強さが採用基準に届きませんでした。 構成企業の中央値が市場平均を上回りませんでした。 一社集中を否定できないため除外しました。"},{"field":"/dynamic_excluded/1/id","value":"homebuilders"},{"field":"/dynamic_excluded/1/label","value":"住宅建設"},{"field":"/dynamic_excluded/1/explanation","value":"業種ETFの4週相対強度が採用基準に届きませんでした。 構成企業の直近の強さが採用基準に届きませんでした。 50日線を上回る企業が半数未満でした。 構成企業の中央値が市場平均を上回りませんでした。 一社集中を否定できないため除外しました。"},{"field":"/dynamic_excluded/2/id","value":"infrastructure_construction"},{"field":"/dynamic_excluded/2/label","value":"インフラ建設"},{"field":"/dynamic_excluded/2/explanation","value":"業種ETFの4週相対強度が採用基準に届きませんでした。 構成企業の直近の強さが採用基準に届きませんでした。 50日線を上回る企業が半数未満でした。 構成企業の中央値が市場平均を上回りませんでした。 一社集中を否定できないため除外しました。"},{"field":"/dynamic_excluded/3/id","value":"regional_banks"},{"field":"/dynamic_excluded/3/label","value":"地方銀行"},{"field":"/dynamic_excluded/3/explanation","value":"業種ETFの4週相対強度が採用基準に届きませんでした。 構成企業の直近の強さが採用基準に届きませんでした。 構成企業の中央値が市場平均を上回りませんでした。 一社集中を否定できないため除外しました。"},{"field":"/dynamic_excluded/4/id","value":"retail"},{"field":"/dynamic_excluded/4/label","value":"小売"},{"field":"/dynamic_excluded/4/explanation","value":"業種ETFの4週相対強度が採用基準に届きませんでした。 50日線を上回る企業が半数未満でした。"},{"field":"/dynamic_excluded/5/id","value":"transportation"},{"field":"/dynamic_excluded/5/label","value":"運輸"},{"field":"/dynamic_excluded/5/explanation","value":"業種ETFの4週相対強度が採用基準に届きませんでした。"},{"field":"/breadth_and_concentration/0","value":"順位はS&P 500に対する4週相対強度を基準にしています。"}],"kind":"detail","meta":{"data_date":"2026-07-31","run_id":"b339f8facbff1d3e1914630792af71600db4bc0fc3c86a97398bbc4f46e92b62","source_commit":"f950eed657f796fcaf5bf922150343cddc4f1d8c","source_sha256":"f447d6b09b93c56466ed0064226dae2a93e1c221941b1473f5bbabc60f07aef7","status":"success"},"part":3,"part_count":4,"phase":3,"source_identity":{"analysis_id":"b339f8facbff1d3e1914630792af71600db4bc0fc3c86a97398bbc4f46e92b62","generation_id":"6df6bad82c5e2d0b0cd0c7cf14d597f10416fff5cc750893dd1f3a08413a4848"}}
