{"consumer_contract_version":"2.0","fragments":[{"field":"/investment_meaning","value":"収支を維持できるか」。最大の反対材料は「商品価格下落やコスト上昇で株主還元の原資が減ること」。 COP（石油・ガス開発）は広がり確認用企業です。石油・ガス開発の別企業にも及ぶ上昇の広がりを確認するためです。 最重要確認事項は「生産効率と資本規律が複数の開発企業で確認できるか」。最大の反対材料は「一社の資産構成だけが有利で、同業の現金収支が弱いこと」。 LMT（防衛）は代表企業です。防衛の代表企業として中心的な強さを確認するためです。 最重要確認事項は「予算措置が受注残と量産契約へ転換し、採算も維持できるか」。最大の反対材料は「固定価格契約のコスト超過や調達遅延で利益率が低下すること」。 AVAV（防衛）は広がり確"},{"field":"/investment_meaning","value":"認用企業です。防衛の別企業にも及ぶ上昇の広がりを確認するためです。 最重要確認事項は「航空・ミサイル・電子戦など複数領域で受注が拡大しているか」。最大の反対材料は「特定プログラムだけに依存し、他領域の受注残が増えないこと」。から確認します。"},{"field":"/cautions/0","value":"直接的な資金フロー、過去時点の時価総額、決算直前日程は取得できない場合があります。"},{"field":"/next_checks/0","value":"市場の広がり、候補テーマの50日線上比率、企業業績の裏付けを次週確認します。"}],"kind":"phase","meta":{"data_date":"2026-07-23","run_id":"352903ee123e026d13541e286657d59ea95ed331a39970cc1c5ee98c7a0a3e43","source_commit":"570540590fb6a9ab4defc8dd6e9d292481bed2af","source_sha256":"ecdca81f3cfe59f49970c95ba366c518f1fa8135714499910d37cf49f3186644","status":"success"},"part":2,"part_count":2,"phase":6,"source_identity":{"analysis_id":"352903ee123e026d13541e286657d59ea95ed331a39970cc1c5ee98c7a0a3e43","generation_id":"e29bfda3e4c5534368e35026987f7bc57e2ddcdd2b6aae2833126729a7aeaf48"}}
