{"consumer_contract_version":"2.0","fragments":[{"field":"/comparisons/5/label","value":"クオリティ（財務・収益性の高い企業）"},{"field":"/comparisons/5/return_1w","value":0.011577001955118238},{"field":"/comparisons/5/return_4w","value":0.002056070804909993},{"field":"/comparisons/5/return_13w","value":0.06012546683124165},{"field":"/comparisons/5/relative_strength_1w","value":0.0006151561762477442},{"field":"/comparisons/5/relative_strength_4w","value":0.00035308389944543883},{"field":"/comparisons/5/relative_strength_13w","value":0.017971204186201684},{"field":"/comparisons/6/ticker","value":"SPHB"},{"field":"/comparisons/6/label","value":"高ベータ（市場より値動きの大きい銘柄）"},{"field":"/comparisons/6/return_1w","value":-0.009209974135189314},{"field":"/comparisons/6/return_4w","value":-0.081746531180378},{"field":"/comparisons/6/return_13w","value":0.04059534541524079},{"field":"/comparisons/6/relative_strength_1w","value":-0.020171819914059808},{"field":"/comparisons/6/relative_strength_4w","value":-0.08344951808584256},{"field":"/comparisons/6/relative_strength_13w","value":-0.0015589172297991727},{"field":"/comparisons/7/ticker","value":"USMV"},{"field":"/comparisons/7/label","value":"低ボラティリティ（値動きの小さい銘柄）"},{"field":"/comparisons/7/return_1w","value":0.010108338192695188},{"field":"/comparisons/7/return_4w","value":0.01073383137659989},{"field":"/comparisons/7/return_13w","value":0.03800545515901832},{"field":"/comparisons/7/relative_strength_1w","value":-0.0008535075861753061},{"field":"/comparisons/7/relative_strength_4w","value":0.009030844471135335},{"field":"/comparisons/7/relative_strength_13w","value":-0.004148807486021644},{"field":"/comparisons/8/ticker","value":"VYM"},{"field":"/comparisons/8/label","value":"高配当"},{"field":"/comparisons/8/return_1w","value":-0.0016642360893931452},{"field":"/comparisons/8/return_4w","value":0.023508601438110066},{"field":"/comparisons/8/return_13w","value":0.03673215315825851},{"field":"/comparisons/8/relative_strength_1w","value":-0.012626081868263639},{"field":"/comparisons/8/relative_strength_4w","value":0.021805614532645512},{"field":"/comparisons/8/relative_strength_13w","value":-0.005422109486781457},{"field":"/moving_average_state/0/ticker","value":"ARKK"},{"field":"/moving_average_state/0/above_50dma","value":false},{"field":"/moving_average_state/0/above_200dma","value":false},{"field":"/moving_average_state/0/explanation","value":"50日線は中期、200日線は長期の価格位置を確認する目安です。"},{"field":"/moving_average_state/1/ticker","value":"IJR"},{"field":"/moving_average_state/1/above_50dma","value":true},{"field":"/moving_average_state/1/above_200dma","value":true},{"field":"/moving_average_state/1/explanation","value":"50日線は中期、200日線は長期の価格位置を確認する目安です。"},{"field":"/moving_average_state/2/ticker","value":"IWD"}],"kind":"detail","meta":{"data_date":"2026-07-31","run_id":"1358de247d71e84230463f25033c42fedb81cdae8ba307bafaf9719dfecf525f","source_commit":"2784c3f9e22f27396e9412498f6966e9b81e8c32","source_sha256":"8e2e9f686dc9da9f180a37f714c3a876b0be2ddeebe77ca97aee96f674c88d84","status":"success"},"part":2,"part_count":3,"phase":2,"source_identity":{"analysis_id":"1358de247d71e84230463f25033c42fedb81cdae8ba307bafaf9719dfecf525f","generation_id":"b3a39afecf11c4cb04695f854bdb47d39a67d56f07c7d52d589d4503dd90a563"}}
