{"consumer_contract_version":"2.0","fragments":[{"field":"/buckets/3/items/7/classification_explanation","value":"現在の価格、広がり、集中度または反対材料から、調査優先度を下げています。"},{"field":"/buckets/3/items/7/relative_strength_4w","value":-0.06725058965547462},{"field":"/buckets/3/items/7/breadth_above_50dma","value":0.125},{"field":"/buckets/3/items/7/concentration_top1","value":0.9536956691505466},{"field":"/buckets/3/items/7/structural_context_status","value":"not_assessed"},{"field":"/buckets/3/items/7/recovery_condition","value":"相対強度と上昇銘柄の広がりが同時に改善するかを次回確認します。"},{"field":"/buckets/3/items/7/largest_counter_evidence","value":"反対条件が検出されています。次回の価格と広がりで再確認します。"},{"field":"/buckets/3/items/8/id","value":"defense"},{"field":"/buckets/3/items/8/label","value":"防衛"},{"field":"/buckets/3/items/8/source","value":"fixed_theme"},{"field":"/buckets/3/items/8/classification_explanation","value":"現在の価格、広がり、集中度または反対材料から、調査優先度を下げています。"},{"field":"/buckets/3/items/8/relative_strength_4w","value":0.00020456247432351637},{"field":"/buckets/3/items/8/breadth_above_50dma","value":0.5},{"field":"/buckets/3/items/8/concentration_top1","value":0.3578405062301589},{"field":"/buckets/3/items/8/structural_context_status","value":"not_assessed"},{"field":"/buckets/3/items/8/recovery_condition","value":"相対強度と上昇銘柄の広がりが同時に改善するかを次回確認します。"},{"field":"/buckets/3/items/8/largest_counter_evidence","value":"直接的な資金フロー確認はありません。"},{"field":"/buckets/3/items/9/id","value":"networking_optical"},{"field":"/buckets/3/items/9/label","value":"ネットワーク・光通信"},{"field":"/buckets/3/items/9/source","value":"fixed_theme"},{"field":"/buckets/3/items/9/classification_explanation","value":"現在の価格、広がり、集中度または反対材料から、調査優先度を下げています。"},{"field":"/buckets/3/items/9/relative_strength_4w","value":-0.1871573720574782},{"field":"/buckets/3/items/9/breadth_above_50dma","value":0.14285714285714285},{"field":"/buckets/3/items/9/concentration_top1","value":1.0},{"field":"/buckets/3/items/9/structural_context_status","value":"not_assessed"},{"field":"/buckets/3/items/9/recovery_condition","value":"相対強度と上昇銘柄の広がりが同時に改善するかを次回確認します。"},{"field":"/buckets/3/items/9/largest_counter_evidence","value":"反対条件が検出されています。次回の価格と広がりで再確認します。"},{"field":"/buckets/3/items/10/id","value":"nuclear_uranium"},{"field":"/buckets/3/items/10/label","value":"原子力・ウラン"},{"field":"/buckets/3/items/10/source","value":"fixed_theme"}],"kind":"detail","meta":{"data_date":"2026-07-31","run_id":"ddd12cd862d8798a69811acf9d711c6d25b9b22820369c3e8481914e50c33253","source_commit":"2c79c9ffb6dbda122ad8fc1ef17ccb626567b30c","source_sha256":"a303de70af28eaa996e57ca61be7215c27655252ebfe0a10094ac74858b46230","status":"success"},"part":5,"part_count":6,"phase":4,"source_identity":{"analysis_id":"ddd12cd862d8798a69811acf9d711c6d25b9b22820369c3e8481914e50c33253","generation_id":"981172bcedb346c7d1199450631dd4995234e54afe560cf60ce47d63bddeb25f"}}
