{"consumer_contract_version":"2.0","fragments":[{"field":"/title","value":"企業候補の監査説明"},{"field":"/companies/0/theme_id","value":"oil_gas_exploration"},{"field":"/companies/0/theme_label","value":"石油・ガス開発"},{"field":"/companies/0/ticker","value":"OXY"},{"field":"/companies/0/role","value":"representative"},{"field":"/companies/0/role_label","value":"代表企業"},{"field":"/companies/0/why","value":"石油・ガス開発の代表企業として中心的な強さを確認するためです。"},{"field":"/companies/0/key_check","value":"生産量と実現価格が設備投資後の自由現金収支を維持できるか"},{"field":"/companies/0/counter_evidence","value":"商品価格下落やコスト上昇で株主還元の原資が減ること"},{"field":"/companies/0/research_lens_explanation","value":"テーマを代表する企業として業績の裏付けを確認します。"},{"field":"/companies/1/theme_id","value":"oil_gas_exploration"},{"field":"/companies/1/theme_label","value":"石油・ガス開発"},{"field":"/companies/1/ticker","value":"COP"},{"field":"/companies/1/role","value":"breadth_check"},{"field":"/companies/1/role_label","value":"広がり確認用企業"},{"field":"/companies/1/why","value":"石油・ガス開発の別企業にも及ぶ上昇の広がりを確認するためです。"},{"field":"/companies/1/key_check","value":"生産効率と資本規律が複数の開発企業で確認できるか"},{"field":"/companies/1/counter_evidence","value":"一社の資産構成だけが有利で、同業の現金収支が弱いこと"},{"field":"/companies/1/research_lens_explanation","value":"同じテーマの別企業にも改善が広がっているかを確認します。"},{"field":"/caution","value":"企業候補はテーマ検証の観測対象であり、売買推奨ではありません。"}],"kind":"detail","meta":{"data_date":"2026-07-31","run_id":"3c07b5c0e7a3ed0c8aabcce577be51f4906abff8755f2e1f16305b55a043dbdb","source_commit":"742e59c2db9c59bc4956cee6e6925060323fb825","source_sha256":"a3f410670be797e1f45928e50de23cc216c1d0717e3ffb58f6d7ed19e3b28c8b","status":"success"},"part":1,"part_count":1,"phase":5,"source_identity":{"analysis_id":"3c07b5c0e7a3ed0c8aabcce577be51f4906abff8755f2e1f16305b55a043dbdb","generation_id":"6c2260ba8b98d8fccd20d14e35fb616ff40e1d7bc1d7af296cf514e962deffa0"}}
