{"consumer_contract_version":"2.0","fragments":[{"field":"/buckets/0/items/2/recovery_condition","value":"相対強度と上昇銘柄の広がりが同時に改善するかを次回確認します。"},{"field":"/buckets/0/items/2/largest_counter_evidence","value":"明示的な反対条件は検出されていません。"},{"field":"/buckets/0/items/3/id","value":"defense"},{"field":"/buckets/0/items/3/label","value":"防衛"},{"field":"/buckets/0/items/3/source","value":"fixed_theme"},{"field":"/buckets/0/items/3/classification_explanation","value":"現在の相対強度、広がり、集中度が調査を進める条件を満たしています。"},{"field":"/buckets/0/items/3/relative_strength_4w","value":0.05626656708041834},{"field":"/buckets/0/items/3/breadth_above_50dma","value":0.5},{"field":"/buckets/0/items/3/concentration_top1","value":0.2537867464540494},{"field":"/buckets/0/items/3/structural_context_status","value":"not_assessed"},{"field":"/buckets/0/items/3/recovery_condition","value":"相対強度と上昇銘柄の広がりが同時に改善するかを次回確認します。"},{"field":"/buckets/0/items/3/largest_counter_evidence","value":"直接的な資金フロー確認はありません。"},{"field":"/buckets/1/bucket","value":"watch_recovery"},{"field":"/buckets/1/label","value":"回復確認候補"},{"field":"/buckets/1/explanation","value":"現時点では不足があり、回復条件の確認を待つ分類です。"},{"field":"/buckets/1/items/0/id","value":"ai_semis"},{"field":"/buckets/1/items/0/label","value":"AI半導体"},{"field":"/buckets/1/items/0/source","value":"fixed_theme"},{"field":"/buckets/1/items/0/classification_explanation","value":"中期の強さを残す一方、直近の回復確認が必要です。"},{"field":"/buckets/1/items/0/relative_strength_4w","value":-0.08512414832181227},{"field":"/buckets/1/items/0/breadth_above_50dma","value":0.25},{"field":"/buckets/1/items/0/concentration_top1","value":0.39139631456875784},{"field":"/buckets/1/items/0/structural_context_status","value":"not_assessed"},{"field":"/buckets/1/items/0/recovery_condition","value":"相対強度と上昇銘柄の広がりが同時に改善するかを次回確認します。"},{"field":"/buckets/1/items/0/largest_counter_evidence","value":"直接的な資金フロー確認はありません。"},{"field":"/buckets/1/items/1/id","value":"networking_optical"},{"field":"/buckets/1/items/1/label","value":"ネットワーク・光通信"},{"field":"/buckets/1/items/1/source","value":"fixed_theme"},{"field":"/buckets/1/items/1/classification_explanation","value":"中期の強さを残す一方、直近の回復確認が必要です。"},{"field":"/buckets/1/items/1/relative_strength_4w","value":-0.11249980753431335},{"field":"/buckets/1/items/1/breadth_above_50dma","value":0.2857142857142857},{"field":"/buckets/1/items/1/concentration_top1","value":0.9923285204208079}],"kind":"detail","meta":{"data_date":"2026-07-23","run_id":"352903ee123e026d13541e286657d59ea95ed331a39970cc1c5ee98c7a0a3e43","source_commit":"570540590fb6a9ab4defc8dd6e9d292481bed2af","source_sha256":"ecdca81f3cfe59f49970c95ba366c518f1fa8135714499910d37cf49f3186644","status":"success"},"part":2,"part_count":6,"phase":4,"source_identity":{"analysis_id":"352903ee123e026d13541e286657d59ea95ed331a39970cc1c5ee98c7a0a3e43","generation_id":"e29bfda3e4c5534368e35026987f7bc57e2ddcdd2b6aae2833126729a7aeaf48"}}
