{"consumer_contract_version":"2.0","fragments":[{"field":"/conclusion","value":"個別企業を調べる対象は石油・ガス開発です。回復条件を監視する対象は地方銀行、AI半導体、半導体製造装置です。長期材料はあるが、現在の株価は弱い対象は該当なしです。現在は避ける対象はバイオテクノロジー、住宅建設、インフラ建設、小売、運輸、AIソフトウェア・データ基盤、サイバーセキュリティ、データセンター電力・インフラ、防衛、ネットワーク・光通信、原子力・ウランです。"},{"field":"/investment_meaning","value":"条件を満たす対象が少ない週は、件数を埋めず現金余力と調査時間を温存します。"},{"field":"/cautions/0","value":"政策や長期材料が良くても、現在の株価が弱い対象は自動的に昇格しません。"},{"field":"/next_checks/0","value":"回復条件を監視する対象が50日移動平均線と市場平均比を回復するか"}],"kind":"phase","meta":{"data_date":"2026-07-31","run_id":"3c4bc2da1e97a0507e0e94304780373c55b3541611e103ff45b3eab6ae506a7c","source_commit":"2f4aad201ab6fc58fb363ba4ee371a149a6671b3","source_sha256":"aabee7e8c8b891bbf560c631d91b601c7dd482e70e1ca40cf11c35eaf4a9e2d2","status":"success"},"part":1,"part_count":1,"phase":4,"source_identity":{"analysis_id":"3c4bc2da1e97a0507e0e94304780373c55b3541611e103ff45b3eab6ae506a7c","generation_id":"36c2239acd07a38c378706b5f81faa2904e3cf81d42fd36859c4c27ba328d869"}}
