{"consumer_contract_version":"2.0","fragments":[{"field":"/title","value":"最終判断要約の監査説明"},{"field":"/market_basis/0","value":"市場分類: real_asset_leadership"},{"field":"/market_basis/1","value":"信頼度: medium"},{"field":"/market_basis/2","value":"市場、スタイル、セクター、テーマ、企業の順に同一snapshotを確認しています。"},{"field":"/bucket_counts/research_now","value":1},{"field":"/bucket_counts/watch_recovery","value":3},{"field":"/bucket_counts/long_term_context_price_weak","value":0},{"field":"/bucket_counts/avoid_now","value":11},{"field":"/company_count","value":2},{"field":"/analysis_mode","value":"initial_observation"},{"field":"/constraints/0","value":"OVERLAP:CEG"},{"field":"/constraints/1","value":"OVERLAP:PLTR"},{"field":"/constraints/2","value":"OVERLAP:VST"},{"field":"/change_conditions/0","value":"次週に相対強度、上昇銘柄の広がり、移動平均位置、集中度が変化した場合は分類が変わり得ます。"},{"field":"/change_conditions/1","value":"新しい公開データは「更新」でのみ取得し、会話途中に別generationを混ぜません。"},{"field":"/not_implemented/0","value":"ETF・fundの直接的な資金フローデータは現在の分析に直接使用していません。"},{"field":"/not_implemented/1","value":"投資家ポジショニングデータは現在の分析に直接使用していません。"},{"field":"/not_implemented/2","value":"時点整合した時価総額データは現在の分析に直接使用していません。"}],"kind":"detail","meta":{"data_date":"2026-07-31","run_id":"3c4bc2da1e97a0507e0e94304780373c55b3541611e103ff45b3eab6ae506a7c","source_commit":"2f4aad201ab6fc58fb363ba4ee371a149a6671b3","source_sha256":"aabee7e8c8b891bbf560c631d91b601c7dd482e70e1ca40cf11c35eaf4a9e2d2","status":"success"},"part":1,"part_count":1,"phase":6,"source_identity":{"analysis_id":"3c4bc2da1e97a0507e0e94304780373c55b3541611e103ff45b3eab6ae506a7c","generation_id":"36c2239acd07a38c378706b5f81faa2904e3cf81d42fd36859c4c27ba328d869"}}
