{"consumer_contract_version":"2.0","fragments":[{"field":"/buckets/3/items/10/classification_explanation","value":"現在の価格、広がり、集中度または反対材料から、調査優先度を下げています。"},{"field":"/buckets/3/items/10/relative_strength_4w","value":-0.07582722095710501},{"field":"/buckets/3/items/10/breadth_above_50dma","value":0.14285714285714285},{"field":"/buckets/3/items/10/concentration_top1","value":0.6381845814035357},{"field":"/buckets/3/items/10/structural_context_status","value":"not_assessed"},{"field":"/buckets/3/items/10/recovery_condition","value":"相対強度と上昇銘柄の広がりが同時に改善するかを次回確認します。"},{"field":"/buckets/3/items/10/largest_counter_evidence","value":"反対条件が検出されています。次回の価格と広がりで再確認します。"}],"kind":"detail","meta":{"data_date":"2026-07-31","run_id":"3c4bc2da1e97a0507e0e94304780373c55b3541611e103ff45b3eab6ae506a7c","source_commit":"2f4aad201ab6fc58fb363ba4ee371a149a6671b3","source_sha256":"aabee7e8c8b891bbf560c631d91b601c7dd482e70e1ca40cf11c35eaf4a9e2d2","status":"success"},"part":6,"part_count":6,"phase":4,"source_identity":{"analysis_id":"3c4bc2da1e97a0507e0e94304780373c55b3541611e103ff45b3eab6ae506a7c","generation_id":"36c2239acd07a38c378706b5f81faa2904e3cf81d42fd36859c4c27ba328d869"}}
