{"consumer_contract_version":"2.0","fragments":[{"field":"/companies/6/research_lens_explanation","value":"テーマを代表する企業として業績の裏付けを確認します。"},{"field":"/companies/7/theme_id","value":"defense"},{"field":"/companies/7/theme_label","value":"防衛"},{"field":"/companies/7/ticker","value":"AVAV"},{"field":"/companies/7/role","value":"breadth_check"},{"field":"/companies/7/role_label","value":"広がり確認用企業"},{"field":"/companies/7/why","value":"防衛の別企業にも及ぶ上昇の広がりを確認するためです。"},{"field":"/companies/7/key_check","value":"航空・ミサイル・電子戦など複数領域で受注が拡大しているか"},{"field":"/companies/7/counter_evidence","value":"特定プログラムだけに依存し、他領域の受注残が増えないこと"},{"field":"/companies/7/research_lens_explanation","value":"同じテーマの別企業にも改善が広がっているかを確認します。"},{"field":"/caution","value":"企業候補はテーマ検証の観測対象であり、売買推奨ではありません。"}],"kind":"detail","meta":{"data_date":"2026-07-23","run_id":"352903ee123e026d13541e286657d59ea95ed331a39970cc1c5ee98c7a0a3e43","source_commit":"570540590fb6a9ab4defc8dd6e9d292481bed2af","source_sha256":"ecdca81f3cfe59f49970c95ba366c518f1fa8135714499910d37cf49f3186644","status":"success"},"part":3,"part_count":3,"phase":5,"source_identity":{"analysis_id":"352903ee123e026d13541e286657d59ea95ed331a39970cc1c5ee98c7a0a3e43","generation_id":"e29bfda3e4c5534368e35026987f7bc57e2ddcdd2b6aae2833126729a7aeaf48"}}
