{"consumer_contract_version":"2.0","fragments":[{"field":"/title","value":"テーマ4分類の監査説明"},{"field":"/buckets/0/bucket","value":"research_now"},{"field":"/buckets/0/label","value":"今調べる候補"},{"field":"/buckets/0/explanation","value":"相対強度、広がり、集中度などが現在の調査条件を満たしています。"},{"field":"/buckets/0/items/0/id","value":"oil_gas_exploration"},{"field":"/buckets/0/items/0/label","value":"石油・ガス開発"},{"field":"/buckets/0/items/0/source","value":"dynamic_industry"},{"field":"/buckets/0/items/0/classification_explanation","value":"現在の相対強度、広がり、集中度が調査を進める条件を満たしています。"},{"field":"/buckets/0/items/0/relative_strength_4w","value":0.16309960345421087},{"field":"/buckets/0/items/0/breadth_above_50dma","value":1.0},{"field":"/buckets/0/items/0/concentration_top1","value":0.23144560520749094},{"field":"/buckets/0/items/0/structural_context_status","value":"not_assessed"},{"field":"/buckets/0/items/0/recovery_condition","value":"相対強度と上昇銘柄の広がりが同時に改善するかを次回確認します。"},{"field":"/buckets/0/items/0/largest_counter_evidence","value":"明示的な反対条件は検出されていません。"},{"field":"/buckets/1/bucket","value":"watch_recovery"},{"field":"/buckets/1/label","value":"回復確認候補"},{"field":"/buckets/1/explanation","value":"現時点では不足があり、回復条件の確認を待つ分類です。"},{"field":"/buckets/1/items/0/id","value":"regional_banks"},{"field":"/buckets/1/items/0/label","value":"地方銀行"},{"field":"/buckets/1/items/0/source","value":"dynamic_industry"},{"field":"/buckets/1/items/0/classification_explanation","value":"中期の強さを残す一方、直近の回復確認が必要です。"},{"field":"/buckets/1/items/0/relative_strength_4w","value":-0.007175293349546845},{"field":"/buckets/1/items/0/breadth_above_50dma","value":1.0},{"field":"/buckets/1/items/0/concentration_top1","value":0.7443993341574197},{"field":"/buckets/1/items/0/structural_context_status","value":"not_assessed"},{"field":"/buckets/1/items/0/recovery_condition","value":"相対強度と上昇銘柄の広がりが同時に改善するかを次回確認します。"},{"field":"/buckets/1/items/0/largest_counter_evidence","value":"明示的な反対条件は検出されていません。"},{"field":"/buckets/1/items/1/id","value":"ai_semis"},{"field":"/buckets/1/items/1/label","value":"AI半導体"},{"field":"/buckets/1/items/1/source","value":"fixed_theme"},{"field":"/buckets/1/items/1/classification_explanation","value":"中期の強さを残す一方、直近の回復確認が必要です。"},{"field":"/buckets/1/items/1/relative_strength_4w","value":-0.1430738547902723},{"field":"/buckets/1/items/1/breadth_above_50dma","value":0.0},{"field":"/buckets/1/items/1/concentration_top1","value":0.7847527737443777}],"kind":"detail","meta":{"data_date":"2026-07-31","run_id":"1358de247d71e84230463f25033c42fedb81cdae8ba307bafaf9719dfecf525f","source_commit":"2784c3f9e22f27396e9412498f6966e9b81e8c32","source_sha256":"8e2e9f686dc9da9f180a37f714c3a876b0be2ddeebe77ca97aee96f674c88d84","status":"success"},"part":1,"part_count":6,"phase":4,"source_identity":{"analysis_id":"1358de247d71e84230463f25033c42fedb81cdae8ba307bafaf9719dfecf525f","generation_id":"b3a39afecf11c4cb04695f854bdb47d39a67d56f07c7d52d589d4503dd90a563"}}
