{"consumer_contract_version":"2.0","fragments":[{"field":"/buckets/3/items/3/classification_explanation","value":"現在の価格、広がり、集中度または反対材料から、調査優先度を下げています。"},{"field":"/buckets/3/items/3/relative_strength_4w","value":0.02704018167982496},{"field":"/buckets/3/items/3/breadth_above_50dma","value":0.2},{"field":"/buckets/3/items/3/concentration_top1","value":0.5510312623651039},{"field":"/buckets/3/items/3/structural_context_status","value":"not_assessed"},{"field":"/buckets/3/items/3/recovery_condition","value":"相対強度と上昇銘柄の広がりが同時に改善するかを次回確認します。"},{"field":"/buckets/3/items/3/largest_counter_evidence","value":"明示的な反対条件は検出されていません。"},{"field":"/buckets/3/items/4/id","value":"transportation"},{"field":"/buckets/3/items/4/label","value":"運輸"},{"field":"/buckets/3/items/4/source","value":"dynamic_industry"},{"field":"/buckets/3/items/4/classification_explanation","value":"現在の価格、広がり、集中度または反対材料から、調査優先度を下げています。"},{"field":"/buckets/3/items/4/relative_strength_4w","value":0.006701828872801871},{"field":"/buckets/3/items/4/breadth_above_50dma","value":0.5},{"field":"/buckets/3/items/4/concentration_top1","value":0.3549777191475711},{"field":"/buckets/3/items/4/structural_context_status","value":"not_assessed"},{"field":"/buckets/3/items/4/recovery_condition","value":"相対強度と上昇銘柄の広がりが同時に改善するかを次回確認します。"},{"field":"/buckets/3/items/4/largest_counter_evidence","value":"明示的な反対条件は検出されていません。"},{"field":"/buckets/3/items/5/id","value":"ai_software_data"},{"field":"/buckets/3/items/5/label","value":"AIソフトウェア・データ基盤"},{"field":"/buckets/3/items/5/source","value":"fixed_theme"},{"field":"/buckets/3/items/5/classification_explanation","value":"現在の価格、広がり、集中度または反対材料から、調査優先度を下げています。"},{"field":"/buckets/3/items/5/relative_strength_4w","value":0.0394428375805183},{"field":"/buckets/3/items/5/breadth_above_50dma","value":0.7142857142857143},{"field":"/buckets/3/items/5/concentration_top1","value":0.5325124773064013},{"field":"/buckets/3/items/5/structural_context_status","value":"not_assessed"},{"field":"/buckets/3/items/5/recovery_condition","value":"相対強度と上昇銘柄の広がりが同時に改善するかを次回確認します。"},{"field":"/buckets/3/items/5/largest_counter_evidence","value":"直接的な資金フロー確認はありません。"},{"field":"/buckets/3/items/6/id","value":"dc_power_infra"},{"field":"/buckets/3/items/6/label","value":"データセンター電力・インフラ"},{"field":"/buckets/3/items/6/source","value":"fixed_theme"}],"kind":"detail","meta":{"data_date":"2026-07-31","run_id":"1358de247d71e84230463f25033c42fedb81cdae8ba307bafaf9719dfecf525f","source_commit":"2784c3f9e22f27396e9412498f6966e9b81e8c32","source_sha256":"8e2e9f686dc9da9f180a37f714c3a876b0be2ddeebe77ca97aee96f674c88d84","status":"success"},"part":4,"part_count":6,"phase":4,"source_identity":{"analysis_id":"1358de247d71e84230463f25033c42fedb81cdae8ba307bafaf9719dfecf525f","generation_id":"b3a39afecf11c4cb04695f854bdb47d39a67d56f07c7d52d589d4503dd90a563"}}
