{"consumer_contract_version":"2.0","fragments":[{"field":"/moving_average_state/2/above_50dma","value":true},{"field":"/moving_average_state/2/above_200dma","value":true},{"field":"/moving_average_state/2/explanation","value":"50日線は中期、200日線は長期の価格位置を確認する目安です。"},{"field":"/moving_average_state/3/ticker","value":"IWF"},{"field":"/moving_average_state/3/above_50dma","value":false},{"field":"/moving_average_state/3/above_200dma","value":true},{"field":"/moving_average_state/3/explanation","value":"50日線は中期、200日線は長期の価格位置を確認する目安です。"},{"field":"/moving_average_state/4/ticker","value":"MTUM"},{"field":"/moving_average_state/4/above_50dma","value":false},{"field":"/moving_average_state/4/above_200dma","value":true},{"field":"/moving_average_state/4/explanation","value":"50日線は中期、200日線は長期の価格位置を確認する目安です。"},{"field":"/moving_average_state/5/ticker","value":"QUAL"},{"field":"/moving_average_state/5/above_50dma","value":true},{"field":"/moving_average_state/5/above_200dma","value":true},{"field":"/moving_average_state/5/explanation","value":"50日線は中期、200日線は長期の価格位置を確認する目安です。"},{"field":"/moving_average_state/6/ticker","value":"SPHB"},{"field":"/moving_average_state/6/above_50dma","value":false},{"field":"/moving_average_state/6/above_200dma","value":true},{"field":"/moving_average_state/6/explanation","value":"50日線は中期、200日線は長期の価格位置を確認する目安です。"},{"field":"/moving_average_state/7/ticker","value":"USMV"},{"field":"/moving_average_state/7/above_50dma","value":true},{"field":"/moving_average_state/7/above_200dma","value":true},{"field":"/moving_average_state/7/explanation","value":"50日線は中期、200日線は長期の価格位置を確認する目安です。"},{"field":"/moving_average_state/8/ticker","value":"VYM"},{"field":"/moving_average_state/8/above_50dma","value":true},{"field":"/moving_average_state/8/above_200dma","value":true},{"field":"/moving_average_state/8/explanation","value":"50日線は中期、200日線は長期の価格位置を確認する目安です。"},{"field":"/interpretation_notes/0","value":"1週・4週・13週を併記し、短期だけの変化を長期傾向と混同しません。"},{"field":"/interpretation_notes/1","value":"相対強度はS&P 500との差であり、直接的な資金フローではありません。"}],"kind":"detail","meta":{"data_date":"2026-07-31","run_id":"1358de247d71e84230463f25033c42fedb81cdae8ba307bafaf9719dfecf525f","source_commit":"2784c3f9e22f27396e9412498f6966e9b81e8c32","source_sha256":"8e2e9f686dc9da9f180a37f714c3a876b0be2ddeebe77ca97aee96f674c88d84","status":"success"},"part":3,"part_count":3,"phase":2,"source_identity":{"analysis_id":"1358de247d71e84230463f25033c42fedb81cdae8ba307bafaf9719dfecf525f","generation_id":"b3a39afecf11c4cb04695f854bdb47d39a67d56f07c7d52d589d4503dd90a563"}}
