{"consumer_contract_version":"2.0","fragments":[{"field":"/conclusion","value":"強いセクターはエネルギー、金融、生活必需品です。固定テーマ外では石油・ガス開発。"},{"field":"/investment_meaning","value":"固定テーマとは別に、複数企業へ強さが広がる業種だけを後続調査へ渡します。"},{"field":"/cautions/0","value":"単一企業だけの急騰や、構成企業が3社未満の業種は候補にしません。"},{"field":"/next_checks/0","value":"新たに見つかった業種の構成企業が市場平均を上回り続けるか"}],"kind":"phase","meta":{"data_date":"2026-07-31","run_id":"3c07b5c0e7a3ed0c8aabcce577be51f4906abff8755f2e1f16305b55a043dbdb","source_commit":"742e59c2db9c59bc4956cee6e6925060323fb825","source_sha256":"a3f410670be797e1f45928e50de23cc216c1d0717e3ffb58f6d7ed19e3b28c8b","status":"success"},"part":1,"part_count":1,"phase":3,"source_identity":{"analysis_id":"3c07b5c0e7a3ed0c8aabcce577be51f4906abff8755f2e1f16305b55a043dbdb","generation_id":"6c2260ba8b98d8fccd20d14e35fb616ff40e1d7bc1d7af296cf514e962deffa0"}}
