{"consumer_contract_version":"2.0","fragments":[{"field":"/companies/3/why","value":"運輸の別企業にも及ぶ上昇の広がりを確認するためです。"},{"field":"/companies/3/key_check","value":"鉄道・物流・小口配送の複数経路で荷動きが回復しているか"},{"field":"/companies/3/counter_evidence","value":"一つの輸送形態だけが強く、業界全体の取扱量が増えないこと"},{"field":"/companies/3/research_lens_explanation","value":"同じテーマの別企業にも改善が広がっているかを確認します。"},{"field":"/companies/4/theme_id","value":"oil_gas_exploration"},{"field":"/companies/4/theme_label","value":"石油・ガス開発"},{"field":"/companies/4/ticker","value":"OXY"},{"field":"/companies/4/role","value":"representative"},{"field":"/companies/4/role_label","value":"代表企業"},{"field":"/companies/4/why","value":"石油・ガス開発の代表企業として中心的な強さを確認するためです。"},{"field":"/companies/4/key_check","value":"生産量と実現価格が設備投資後の自由現金収支を維持できるか"},{"field":"/companies/4/counter_evidence","value":"商品価格下落やコスト上昇で株主還元の原資が減ること"},{"field":"/companies/4/research_lens_explanation","value":"テーマを代表する企業として業績の裏付けを確認します。"},{"field":"/companies/5/theme_id","value":"oil_gas_exploration"},{"field":"/companies/5/theme_label","value":"石油・ガス開発"},{"field":"/companies/5/ticker","value":"COP"},{"field":"/companies/5/role","value":"breadth_check"},{"field":"/companies/5/role_label","value":"広がり確認用企業"},{"field":"/companies/5/why","value":"石油・ガス開発の別企業にも及ぶ上昇の広がりを確認するためです。"},{"field":"/companies/5/key_check","value":"生産効率と資本規律が複数の開発企業で確認できるか"},{"field":"/companies/5/counter_evidence","value":"一社の資産構成だけが有利で、同業の現金収支が弱いこと"},{"field":"/companies/5/research_lens_explanation","value":"同じテーマの別企業にも改善が広がっているかを確認します。"},{"field":"/companies/6/theme_id","value":"defense"},{"field":"/companies/6/theme_label","value":"防衛"},{"field":"/companies/6/ticker","value":"LMT"},{"field":"/companies/6/role","value":"representative"},{"field":"/companies/6/role_label","value":"代表企業"},{"field":"/companies/6/why","value":"防衛の代表企業として中心的な強さを確認するためです。"},{"field":"/companies/6/key_check","value":"予算措置が受注残と量産契約へ転換し、採算も維持できるか"},{"field":"/companies/6/counter_evidence","value":"固定価格契約のコスト超過や調達遅延で利益率が低下すること"}],"kind":"detail","meta":{"data_date":"2026-07-23","run_id":"352903ee123e026d13541e286657d59ea95ed331a39970cc1c5ee98c7a0a3e43","source_commit":"570540590fb6a9ab4defc8dd6e9d292481bed2af","source_sha256":"ecdca81f3cfe59f49970c95ba366c518f1fa8135714499910d37cf49f3186644","status":"success"},"part":2,"part_count":3,"phase":5,"source_identity":{"analysis_id":"352903ee123e026d13541e286657d59ea95ed331a39970cc1c5ee98c7a0a3e43","generation_id":"e29bfda3e4c5534368e35026987f7bc57e2ddcdd2b6aae2833126729a7aeaf48"}}
