{"consumer_contract_version":"2.0","fragments":[{"field":"/conclusion","value":"今週は資源関連の株価が市場平均より強くなっています。個別企業を調べる対象は石油・ガス開発、回復条件を監視する対象は地方銀行、AI半導体、サイバーセキュリティ、半導体製造装置、長期材料はあるが、現在の株価は弱い対象は該当なし、現在は避ける対象はバイオテクノロジー、住宅建設、インフラ建設、小売、運輸、AIソフトウェア・データ基盤、データセンター電力・インフラ、防衛、ネットワーク・光通信、原子力・ウランです。"},{"field":"/investment_meaning","value":"個別企業はOXY（石油・ガス開発）は代表企業です。石油・ガス開発の代表企業として中心的な強さを確認するためです。 最重要確認事項は「生産量と実現価格が設備投資後の自由現金収支を維持できるか」。最大の反対材料は「商品価格下落やコスト上昇で株主還元の原資が減ること」。 COP（石油・ガス開発）は広がり確認用企業です。石油・ガス開発の別企業にも及ぶ上昇の広がりを確認するためです。 最重要確認事項は「生産効率と資本規律が複数の開発企業で確認できるか」。最大の反対材料は「一社の資産構成だけが有利で、同業の現金収支が弱いこと」。から確認します。"},{"field":"/cautions/0","value":"直接的な資金フロー、過去時点の時価総額、決算直前日程は取得できない場合があります。"},{"field":"/next_checks/0","value":"市場の広がり、候補テーマの50日線上比率、企業業績の裏付けを次週確認します。"}],"kind":"phase","meta":{"data_date":"2026-07-31","run_id":"1358de247d71e84230463f25033c42fedb81cdae8ba307bafaf9719dfecf525f","source_commit":"2784c3f9e22f27396e9412498f6966e9b81e8c32","source_sha256":"8e2e9f686dc9da9f180a37f714c3a876b0be2ddeebe77ca97aee96f674c88d84","status":"success"},"part":1,"part_count":1,"phase":6,"source_identity":{"analysis_id":"1358de247d71e84230463f25033c42fedb81cdae8ba307bafaf9719dfecf525f","generation_id":"b3a39afecf11c4cb04695f854bdb47d39a67d56f07c7d52d589d4503dd90a563"}}
